Title,Intro Text,Authors,Article Text,Date Published
 Scaly stowaway: lizard makes an appearance at Chelsea flower show,Gardeners at the Yeo Valley Organic display were delighted to find the common brown lizard in a pile of logs,['Helena Horton'],"Visitors to Chelsea flower show come from all over the country, and range from senior royals to interested gardeners looking for some new plants.This year, however, there has been a rather special guest – a common brown lizard. Gardeners at the Yeo Valley Organic display were delighted to find him in a pile of logs.In the past, Chelsea was known as a showcase of perfectly manicured lawns and prize-winning blooms in symmetrical flower beds. But there is now a clear trend towards nature-friendly gardening. This has been somewhat controversial, with veteran gardeners including the Royal Horticultural Society rose expert Charles Quest-Ritson arguing that people do not attend flower shows to see piles of logs and patches of nettles. He believes prizes should not be given for “weeds”.But Quest-Ritson is in the minority, and this year’s show features multitudes of nature and eco-friendly gardens including a Cop26 garden and a woodland planting supported by Prince Charles, which urges visitors to “plant a tree for the Queen”.Late flowering: the Chelsea flower show is finally back – but what will it look like in autumn?Read moreYeo Valley Organic’s garden is built to attract amphibians and reptiles, as well as pollinators and insects. It seems to have achieved that aim, with the lizard making himself at home in the log pile.Sarah Mead, who created the Yeo Valley Organic garden, which is a permanent fixture at the company’s farm in Somerset, said there had been a discussion about whether the lizard had hitchhiked from the farm, where materials from the original garden were transported for the mini Chelsea version, or whether had it crawled in as a rare example of a London lizard.She said: “It’s definitely a common brown lizard – there are lots of them in the West Country so we are sure it came down from Yeo Valley in Somerset among the stone that was transported from the farm, but it’s made itself quite at home here.“As lizards are cold-blooded, they like the stone – it’s Mendip stone they’ve brought up from the dry stone walls on the farm, so a perfect environment for lizards, cool with lots of nooks and crannies. Lizards are just one example of the rich biodiversity at Yeo Valley, where they do everything to encourage wildlife.”Common lizards are found across the country, but their numbers are declining because of habitat loss. They thrive in grassland and moorland, as well as the edges of woodlands.The gardeners have enlisted experts from the Wildlife Trusts to help them keep the lizard comfortable at the busy show and teach them more about it.Features of the Somerset garden recreated at Chelsea include an open perennial meadow with flowering plants and a glade of silver birch. The design also features charred logs used as garden markers and rammed earth walls as boundaries, both highlighting the importance of soil health. The garden is designed to show how to create a beautiful and peaceful space that encourages nature and has soil health in mind. Tom Massey, who with the help of Mead designed the show garden, said: “The soil plays a pivotal role in our fight to reverse climate change but the world of microscopic activity under our feet is often overlooked. Carbon is the building block of all life and as gardeners we need to be reminded of the role we play in locking carbon into the soil, where it can help sustain life for generations to come. We want to create a beautiful garden that inspires visitors to think about using more sustainable gardening practices.” This article was amended on 29 September 2021 to remove a mistaken reference in a quote to lizards liking “cool” stone; as they are cold-blooded, it is the relative warmth of the stone that attracts them.",2019-12-01
" Climate crisis could lead to rise of smaller bees, study finds","Danger looms for larger species such as bumblebees, which have lower heat tolerance, leading to ‘cascading effects’ on ecosystems",['Agence France-Presse'],"The climate crisis could lead to more small-bodied bees but fewer bumblebees, according to research warning of potential “cascading” effects on plant pollination and across whole ecosystems.Scientists in the US trapped and studied more than 20,000 bees over eight years in an area of the Rocky Mountains to find out how different types reacted to changing climatic conditions.In research published on Wednesday in the journal Proceedings of the Royal Society B, the authors said that while environmental conditions varied from year to year, the sub-alpine region from which they took samples was “particularly vulnerable to climate change”, with generally warming spring temperatures and earlier snow melt.Fears for bees as US set to extend use of toxic pesticides that paralyse insectsRead moreThey found that larger-bodied bees and comb-building cavity nesters declined in abundance as temperatures increased, while smaller, soil-nesting bees increased.“Our research suggests that climate-induced changes in temperature, snowpack and summer precipitation may drastically reshape bee communities,” the authors said.Researchers said the findings suggested a reduction of bigger bees, including in the families of bumblebee, leafcutters and mason bees, with higher temperatures.Declines were particularly marked for bumblebees, which the researchers said suggested “this group is more threatened under climate warming than other bees in our system”. That tallies with other studies showing that bumblebees, the dominant pollinators in many ecosystems, have a lower heat tolerance than other bees and move to cooler regions at higher altitudes as temperatures warm.Researchers said their findings suggested both bumblebees’ body size and nest behaviour could also make them more vulnerable in a warming world.More broadly, the authors said climate-driven changes to pollinator communities “could have cascading effects on pollination and ecosystem functioning”. For example, they said losing bigger bees, which tend to fly further for food, may mean a reduction in longer-distance pollination.The study was specifically focused on mountainous areas, but the researchers said other research across the US showed declines in larger bees in response to environmental changes.Insects are the world’s top pollinators: 75% of 115 top global food crops depend on animal pollination, including cocoa, coffee, almonds and cherries, according to the UN.In a landmark 2019 report, scientists concluded that nearly half of all insect species worldwide are in decline and a third could disappear altogether by century’s end. One in six species of bees have gone regionally extinct somewhere in the world.The main drivers of extinction are thought to be habitat loss and pesticide use.",2022-04-21
 UK energy industry urges ministers to stick with net zero plan,"Some rightwingers claim renewables have increased costs, but Energy UK blames over-reliance on gas","['Fiona Harvey', '  Environment correspondent']","Energy companies want the government to implement policies to achieve net zero greenhouse gas emissions, the industry’s leader has said, despite claims from some on the political right that high energy prices should spark a rethink.Emma Pinchbeck, chief executive of Energy UK, which represents the industry, said: “The government should press on with net zero policies. That’s something they still need to do. We are missing the carbon budgets.”She called on ministers to “tighten energy efficiency”, by insulating more homes, and changing planning and construction rules, while developing a strategy for decarbonising the UK’s fleet of gas-fired power stations.She rejected claims that renewable energy had increased costs, saying the problem was clearly an over-reliance on gas, especially for heating. She told a meeting hosted by the Energy and Climate Intelligence Unit: “The UK is exposed to gas because we have a huge amount of gas burned in our homes, and so helping people get off gas boilers on to other forms of heating technology is critical over the next decades to reduce our reliance on places like Russia.”She added: “But [it’s also necessary] to make our building stock much more energy-efficient. The reason we have high rates of fuel poverty in the UK isn’t just about the commodity we burn, it’s the volume of it we burn because our energy efficiency rates here are much lower than other countries.”Britain’s leaky homes make the energy crisis worse. Why have governments not fixed them? | Max WakefieldRead moreHouseholds are facing an energy price cap rise this April, likely to amount to £2,000 for the average bill, and possibly a further rise to £2,400 in October. The cost-of-living crisis has embroiled the government in calls from its own backbenches to scale back or abandon measures to promote renewable energy and pay for home insulation for poor households, even though renewable energy is many times cheaper than gas and improving home insulation would cut bills for the most vulnerable.Bim Afolami, Conservative MP for Hitchin and Harpenden, called on his fellow Tories to get behind net zero policies, saying only “a very small number” of MPs were questioning them.“Let’s be clear, in terms of delivering net zero, there is no real option other than what the government has set out. It’s a shame that it needs saying, but everyone should rest assured that the bulk of the Conservative party and the government is four-square behind this, and committed to getting it done,” he said.Q&AWhat is net zero?ShowNet zero is the commitment to reducing emissions by 100% so that the UK is producing no more carbon than it removes from the atmosphere. This will have to be achieved by reducing the amount of greenhouse gases created by activities such as industrial processes, power generation, transport and intensive agriculture, while removing emissions at the same time by capturing carbon or planting more trees.It is considered the minimum necessary to stop dangerous climate breakdown increasing the world’s temperature by more than 1.5 degrees celsius. However, there is a debate about how to get there, and how quickly, and how the costs will be spread. The current UK government wants to meet net zero by 2050, which will necessarily involve replacing gas boilers, moving to electric cars, improving insulation and lowering high-carbon consumption such as flights and meat-eating.Was this helpful?Thank you for your feedback.Michael Grubb, professor of energy and climate change at University College London, said consumers were paying unnecessarily high prices for their electricity, as well as their gas, because of the way the UK energy market works. Electricity prices are set by the gas price, even though gas makes up only about 40% of electricity generation and renewable energy prices are far lower.He said the government could ease this by changing the way the UK energy market is structured, allowing for a “pool” of green energy contracts.Ministers should levy a windfall tax on fossil fuel producers, which have seen bumper profits from the global rise in gas prices and Russia’s constraint on European supplies, added Tessa Khan, founder of campaigning organisation Uplift. Taxes on fossil fuels in the UK were far too low, and tiny compared with those of other countries, at about $2 (£1.47) a barrel in the UK compared with more than $20 a barrel for Norway.Even at such low rates, thanks to favourable rules, some fossil fuels had received payouts from the government in recent years, rather than pay tax, she said. Oil and gas producers faced no extra costs but were reaping “windfall profits” from the gas price. “These profits are being privatised. The UK tax regime has made this the most profitable country in the world for oil and gas companies,” she said.",2022-01-20
The bear truth: why happy pandas can’t be bothered to find a partner,Researchers now think pandas’ notoriously low libido is because they are too comfortable to make the effort to search for a mate,,"Name: Panda sex.Age: 18m years old.Frequency: Famously rare.Yes, why is that? If I were a panda, I’d be at it all the time. I think from this we can determine two things: first that you are a pervert, and second that you are unhappy.Hey, I’m not unhappy! Maybe you have more in common with pandas than you thought. Researchers have posited that the notoriously low panda libido might be down to simple contentment.How so? Well, a study published in Conservation Biology has suggested that if pandas find the perfect habitat – in this instance a cool, moderately low-lying area rich with bamboo and far from humans – then they will just happily settle down and not go anywhere.Who can blame them? That sounds perfect. Well, the worry is that by staying in the same area, they aren’t going out to search for food or mates, which reduces their genetic diversity, which will eventually lead to their extinction.So you’re saying that pandas prefer comfortable solitude to sex? Yes.And it’s possible to be so comfortable that you might take down your entire species? Yes.Am … am I a panda? If you are, I have to commend your ability to type so accurately with your great big paws.Do scientists want to make pandas less comfortable? To some extent, yes. The researchers have found that the ideal level of comfort to keep the pandas alive is 80%.Why 80%? Because then they are comfortable enough to thrive, but there’s still enough dissatisfaction to make them leave home, bump into a sexy panda stranger and get it on.Great! Job sorted. Well, that’s only step one. Even if two pandas were to clap eyes on each other and instantly fall in love, it doesn’t mean that we would hear the pitter patter of tiny paws any time soon. Remember the story of Tian Tian?Tian Tian? Yes, one of the UK’s only two giant pandas, leased to Edinburgh zoo a decade ago by the Bifengxia breeding centre in Sichuan, China. The lease runs out in December, and Tian Tian has failed to give birth.Why? Sometimes it just doesn’t happen. She had cubs in China, only to endure a number of failed pregnancies – some initiated by artificial insemination – in Edinburgh. Things went further downhill when her partner, Yang Guang, had his testicles removed, after a tumour was discovered.God, that’s sad. Is it? Or is she just so happy that she has rejected sex as a concept?There’s a moral here, isn’t there? Yes. It’s that it’s OK if personal contentment is more important to you than romantic love. And also that pandas are seemingly determined to make themselves extinct.Do say: “Happy pandas don’t have sex.”Don’t say: “Quick, someone invent Panda Instagram to make them all feel ugly and insecure.”",2021-03-12
 Shell chief vows to bolster emissions strategy after court ruling, Ben van Beurden pledges to ‘rise to challenge’ after court ordered oil firm to cut global carbon emissions by 45%,['Joanna Partridge'],"Royal Dutch Shell has vowed to accelerate its strategy towards becoming a net zero emissions business, two weeks after a Dutch court ruling ordered the company to cut its global carbon emissions by 45% by the end of 2030 compared with 2019 levels.Shell’s chief executive, Ben van Beurden, promised to “rise to the challenge” in helping to create a low-carbon energy system, but came out fighting for the Anglo-Dutch oil company he runs, insisting it has been leading the industry in taking responsibility for its carbon emissions.In a statement on his LinkedIn page, Van Beurden said he was surprised by the court’s verdict and was “disappointed that Shell is being singled out by a ruling that I believe does not help reduce global CO2 emissions”.He added: “A court ordering one energy company to reduce its emissions – and the emissions of its customers – is not the answer.”The transition to low-carbon energy, which remained necessary to battle the climate emergency, was “far too big a challenge for one company to tackle”, he wrote, calling for clearer regulations and policies from global governments.It’s time to nationalize Shell. Private oil companies are no longer fit for purpose | Johanna Bozuwa and Olúfẹ́mi O TáíwòRead moreShell said it was reviewing the ruling handed down last month by a court in The Hague and expected to appeal. But the court has said its decision is immediately applicable and should not be suspended before an appeal.Shell’s oil production had probably peaked in 2019, Van Beurden said, adding that he believed the firm’s total absolute carbon emissions would decline from 2018 levels. Instead, he said Shell should work with its customers to help them find their own way to achieving net zero emissions.The oil firm said it would continue to produce oil and gas products “for a long time to come” in order to meet customer demand and retain the company’s financial strength, while also attracting investment.“Imagine Shell decided to stop selling petrol and diesel today. This would certainly cut Shell’s carbon emissions. But it would not help the world one bit,” Van Beurden wrote. “Demand for fuel would not change. People would fill up their cars and delivery trucks at other service stations.”The company said it had “rigorous, short-term reduction targets” on the way to its goal of becoming a net zero emissions business by 2050. The chief executive added that Shell had taken responsibility for reducing the carbon emissions it produced, as well as those produced when customers used its products.The landmark Dutch case was brought by the environmental group Friends of the Earth and more than 17,000 co-plaintiffs, who successfully argued that Shell had been aware of the dangerous consequences of CO2 emissions for decades, and that and its targets remained insufficiently robust.The company was told by the court that its emission reductions, along with those of its suppliers and buyers, should be brought into line with the Paris climate agreement.Although it intended to appeal against the ruling, Shell said it would “seek ways to reduce emissions even further in a way that remains purposeful and profitable”.As part of its energy transition strategy, Shell said it had in recent years invested “billions of dollars” in lower-carbon energy, including wind and solar power, hydrogen and biofuels.Shell has vowed to give investors a chance to vote on the progress of its transition strategy at every annual shareholder meeting. Van Beurden complained that the court hearing took place several months before the publication of the strategy.Sign up to the daily Business Today email or follow Guardian Business on Twitter at @BusinessDesk Shell faced a significant investor rebellion at its most recent AGM, when a shareholder resolution coordinated by Follow This, a Dutch climate activist group, calling for the company to set binding carbon emissions targets received 30% of votes.Mark van Baal, the founder of Follow This, said Van Beurden had “failed to have his epiphany moment, and still thinks that committing to the Paris agreement is an unfair ask. More stakeholders than ever are pushing for Paris-alignment and there comes a time when Shell will have to listen and act. Butvan Beurden can take comfort that Shell is not alone in this challenge.”Rachel Kennerley, an international climate campaigner at Friends of the Earth, said Shell’s promises did not far enough.She added: “If Mr van Beurden was as serious about this as he claims, he’d stop dismissing his company’s role in driving this devastating situation and would use the court ruling as an intervention to do the right thing, rather than appealing it with all of Shell’s corporate might.”",
Country Diary: Down on the floor with the solitary bees,"Holywell, Flintshire: In my attempts to make my garden more suitable for Mediterranean herbs, I created the conditions for these fascinating insects",['Jan Miller'],"I’m lying on my front on the moist, mossy lawn, the sun warming my back. Around me swallows are swooping in and out of the barn while dandelions, lady’s smock and cowslips attract the butterflies and bees. But down here, my attention is focused under the box hedges of my herb garden. I am watching volcanoes form. Not the sort that spew hot lava, but small cones of the gritty soil with a vent in the top about the size of my little fingernail.A tawny mining bee: ‘The 240 species of solitary bees in Britain … are just as important for pollination as the one species of honeybee.’ Photograph: Jan MillerThese are the entrances to the breeding burrows of the tawny mining bee, Andrena fulva. They are just one of the 240 species of solitary bees in Britain, and are just as important for pollination as the one species of honeybee. Each has different shaped mouthparts, which have evolved alongside flowers with different access routes to their nectar so that the plants are more likely to be pollinated from the same species. And you don’t have to farm the solitaries. This type needs only fine, sandy soil so they can dig deep burrows (and surprisingly quickly too with their tiny legs). They make side chambers and lay one egg in each, with a small supply of nectar and pollen. Then they’re sealed up and the larvae left to hibernate over winter, until they dig their way out the next spring.I could never grow Mediterranean herbs such as thyme, sage, oregano, orpine or lavender in my damp garden until a few years ago, when I had this square dug out and filled with limestone hardcore. Unwittingly, I had also made the perfect place for these mining bees to breed. It also helped that this was under the bit of lawn where we once had the kids’ sandpit.Meanwhile, the osmia mining bees – the red mason and the leafcutter bees you can buy nesting houses for in garden shops – are a different species. I was puzzled to see an osmia scrabbling against the mud-sealed doors once, as I thought it couldn’t be a predator of its own kind. A quick post on the Facebook page of the specialist Bees, Wasps and Ants Recording Society got me an answer in 10 minutes – it was the male who could “smell” the virgin female inside and was desperate to mate with her before any other. Country diary is on Twitter at @gdncountrydiary",2023-06-02
